{
  "schema_version": "jury.review_bundle.v1",
  "exported_at": "2026-05-23T00:00:00.000Z",
  "claim_id": "claim_ci_change",
  "records": {
    "claims": [
      {
        "schema_version": "jury.claim.v1",
        "id": "claim_ci_change",
        "version": 1,
        "summary": "pull request is ready",
        "claimant": "agent:ci",
        "scope": ["jury"],
        "impact": "high",
        "status": "submitted",
        "created_at": "2026-05-23T00:00:00.000Z",
        "updated_at": "2026-05-23T00:00:00.000Z"
      }
    ],
    "checks": [
      {
        "schema_version": "jury.check.v1",
        "id": "check_ci_tests",
        "claim_id": "claim_ci_change",
        "type": "verifier",
        "required": true,
        "status": "passed",
        "assigned_to": "verifier:ci",
        "summary": "Jury tests must pass",
        "evidence_ids": ["ev_ci_tests"],
        "resolution": "node --test jury/test/*.test.mjs passed",
        "created_at": "2026-05-23T00:00:00.000Z",
        "updated_at": "2026-05-23T00:00:00.000Z"
      }
    ],
    "evidence": [
      {
        "schema_version": "jury.evidence.v1",
        "id": "ev_ci_tests",
        "claim_id": "claim_ci_change",
        "type": "command",
        "summary": "Jury tests passed",
        "source": "node --test jury/test/*.test.mjs",
        "status": "passed",
        "command": "node --test jury/test/*.test.mjs",
        "exit_code": 0,
        "stdout": "",
        "stderr": "",
        "collected_at": "2026-05-23T00:00:00.000Z"
      }
    ],
    "objections": [],
    "waivers": [],
    "verdicts": [
      {
        "schema_version": "jury.verdict.v1",
        "id": "verdict_ci_change_accept",
        "claim_id": "claim_ci_change",
        "claim_version": 1,
        "decision": "accept",
        "reason": "Required evidence passed and no blocking objections remain open.",
        "next_actions": [],
        "evidence_ids": ["ev_ci_tests"],
        "objection_ids": [],
        "waiver_ids": [],
        "check_ids": ["check_ci_tests"],
        "decided_by": "judge:ci",
        "decided_at": "2026-05-23T00:00:00.000Z"
      }
    ]
  }
}
